{
  "name": "PancakeSwap V2",
  "chain": "bsc",
  "categories": [
    "dex-amm"
  ],
  "tvl_usd_at_snapshot": 1823000000,
  "repo_url": "https://github.com/pancakeswap/pancake-smart-contracts",
  "doc_urls": [
    "https://docs.pancakeswap.finance"
  ],
  "snapshot_block": 50000000,
  "tier": "A",
  "special_mechanism_summary": "Standard xy=k AMM with 0.17% base fee to LPs and 0.03% to treasury, plus StableSwap pools using a Curve-style amplified bonding curve for stablecoin pairs. As BSC's largest AMM by TVL, PancakeSwap is the primary flash loan source for BSC-native arbitrage and the main price reference for BNB/stablecoin pairs.",
  "notes": "C3' combination potential: serves as primary price oracle for BNB/stablecoin pairs consumed by Venus and Lista lending protocols; $1.8B TVL enables realistic single-transaction flash borrows of $100M+ for large-scale BSC liquidation or arbitrage strategies; predictable 0.20% fee per hop creates reverse-engineerable price impact curves for optimal flash loan sizing.",
  "contracts": [
    {
      "name": "PancakeFactory",
      "address": "0xcA143Ce32Fe78f1f7019d7d551a6402fC5350c73"
    },
    {
      "name": "PancakeRouter",
      "address": "0x10ED43C718714eb63d5aA57B78B54704E256024E"
    }
  ]
}
